tweet_id,time,hashtags,type,faves,retweets,text,mentions
391133766288035840,1382088531,[],,3587,7320,"We need values based on common sense, experience and scientific findings, what I refer to as secular ethics.",[]
32376713878966273,1296554184,[],,469,1739,The aim of spiritual and therefore ethical practice is to transform and perfect the individual’s motivation and mental disposition.,[]
19566533567,1280143954,[],,761,3531,We can’t overcome anger and hatred by simply suppressing them. We need to actively cultivate their antidotes - patience and tolerance.,[]
11692671539,1270551986,[],,8,30,"Today HHDL gives a public talk on Ethics for the New Millennium organized by the University of Maribor, in Maribor, Slovenia",[]
20542645968,1281176914,[],,265,1394,"Where love of one's neighbor, affection, kindness, and compassion live, we find that ethical conduct is automatic.",[]
16215580500,1276598864,[],,38,132,HHDL leaves for Japan tomorrow. Teaching and talk in Yokohama June 26th and full schedule at http://www.tibethouse.jp/dalai_lama/2010japan/,[]
13397628771,1273023760,[],,25,157,"In two hours, live webcast of HHDL and Richard Moore talking to students about forgiveness - 9am IST (GMT+5.30). http://dalailama.com/live",[]
15990751827,1276333445,[],,241,1209,"Because of the profoundly interconnected reality of today’s world, we need to relate to the challenges we face as a single human family",[]
62453396669612032,1303725024,[],,192,1205,"I am saddened by the passing away of Sri Sathya Sai Baba. I offer my condolences and prayers to all his followers, devotees and admirers.",[]
243278261910638592,1346837032,[],,2791,12919,Many of our world's problems and conflicts arise because we have lost sight of the basic humanity that binds us together as a human family.,[]
105565141449449472,1314003665,[],,1676,7875,The practice of love can be expressed in one sentence: ‘Do not harm others’.,[]
306351006231429120,1361874746,[],,4770,16348,"The challenge today is to convince people of the value of truth, honesty, compassion and a concern for others.",[]
141098089749561344,1322475380,[],,1450,7863,Other human beings have a right to peace and happiness that is equal to our own; therefore we have a responsibility to help those in need.,[]
113178022454104064,1315818717,[],,977,5288,Peace has much to do with warm-heartedness and respect for the lives of others.,[]
68124782364864512,1305077188,[],,65,315,"Watch HHDL live from the University of Arkansas, USA, on May 11 at  9:30am and at 1:30pm CDT. http://globalcampus.uark.edu/HHDL/",[]
29169773685,1288431811,[],,385,1715,"Irrespective of doctrinal and other differences, all major world religions are concerned with helping individuals become good human beings.",[]
75493559700176896,1306834041,[],,1186,5616,"When I speak about love and compassion, I don't do so as a Buddhist, or a Tibetan, or as the Dalai Lama, but as one human being to another.",[]
10204136499,1268106598,[],,23,99,There will be a live webcast of the ceremony on 10th March at 8:30am IndianStandardTime (GMT+05). http://bit.ly/7Phnz3,[]
480999222142324736,1403514125,[],,5472,6023,"Non-violence is when one has the chance to harm another but resists from doing so, this is genuine non-violence.",[]
1219974068707328,1289125839,[],,700,2900,"Peace of mind, a calm state of mind, is rooted in affection and compassion.",[]
59910133597208576,1303118663,[],,966,4563,"When we are open to others and ready to show them our friendship and affection, this immediately creates a good environment.",[]
483906881572720642,1404207365,[],,472,485,"Live Webcasts: HHDL's Kalachakra teachings from Ladakh, J&amp;K, India on July 3-13. http://t.co/sAB4Rrd3VE",[]
21391135306,1282038925,[],,825,4562,"Peace does not come through prayer, we human beings must create peace.",[]
77675959196717056,1307354366,[],,91,212,"HHDL interview on Ideas in Action, originally broadcast on PBS in the USA on June 2, 2011. http://youtu.be/9JWtUWjv-UE",[]
21137783692,1281777543,[],,130,920,A concerted international effort is needed to think about measures to preserve our common and delicate ecology.,[]
342936074613579776,1370597306,[],,3179,9539,"I feel that each of us has the potential to make some contribution and together, working with a clear aim, we can change our world.",[]
18971992745058304,1293358250,[],,456,2602,"In order to create a happy century, a peaceful century we must promote the concept of dialogue.",[]
516520320128131072,1411983015,[],,6944,7827,"If you’re angry and resentful it’s like being part of a chain reaction; forgiveness puts a stop to anger, ill-will and a desire for revenge.",[]
26137590868480000,1295066661,[],,77,195,"Watch HHDL's talk to westerners attending the teachings in Sarnath, India, on January 13th, 2011. http://youtu.be/H0wIxrxatSE",[]
9755501504,1267321305,[],,31,139,Update: Live Webcast of His Holiness's teachings 28 Feb 2010 will start approximately at 8:00am. http://bit.ly/arFvaw,[]
428113189281087488,1390905112,[],,6029,9362,It would help if there were greater understanding that anger never helps to solve a problem.,[]
122234431086923776,1317977934,[],,94,502,HHDL sends video birthday greetings on the occasion of Archbishop Desmond Tutu's 80th birthday on October 7th. http://t.co/6YpzdglZ,[]
26634476755,1286444743,[],,589,2799,"Developing a sense of universal responsibility helps us to become sensitive to all others, not just those closest to us.",[]
19656519893,1280237336,[],,584,2553,"If you have strong compassion, strong respect for others, then forgiveness is much easier.",[]
624527565328396288,1437733949,[],,6331,5744,If we’re motivated by a genuine sense of universal responsibility our relations with the environment and our neighbors will be more balanced,[]
16215782430,1276599131,[],,30,84,Photos: Indo-Tibetan Friendship Society celebrates the 50th year of the arrival of HHDL and the Tibetans to Mcleod Ganj http://bit.ly/ciQ33f,[]
188195478729539584,1333704273,[],,1219,6077,I am often asked whether I am optimistic for the future of humanity. My simple answer is yes.,[]
16377157698,1276768837,[],,439,2074,"For our life to be of value, I think we must develop basic good human qualities – warmth, kindness, and compassion.",[]
16761496295,1277200508,[],,306,1326,"Compassion instills a sense of calm, inner strength, and a deep confidence and satisfaction.",[]
199432582805454848,1336383407,[],,1508,7425,"Once you realize that compassion is useful, that it is something really worthwhile, you immediately develop a willingness to cultivate it.",[]
22782207978,1283416455,[],,314,1381,Ethical discipline is the indispensable means for mediating between the competing claims of my right to happiness and others' equal right.,[]
394033435766837249,1382779866,[],,312,508,"Live: Mind &amp; Life XXVII Conference - Desire, Craving and Addiction with HHDL from Dharamsala, India on Oct 28 - Nov 1 http://t.co/jlX58DOpMq",[]
89989313529520128,1310290098,[],,2014,9931,"Love, compassion and concern for others are real sources of happiness.",[]
22601111475060737,1294223499,[],,927,3843,"I feel that the moment you adopt a sense of caring for others, it brings you inner strength.",[]
260310728920150016,1350897888,[],,4225,14164,Genuine happiness comes from focusing on the happiness of others.,[]
21891604785,1282543785,[],,38,100,"Watch HDDL meeting with members of the press during his visit to Manali, India, on August 22nd. http://youtu.be/nr1GYL1e3pk",[]
425575843843174401,1390300162,[],,3022,4602,"Now we’re so interdependent, we need to build trust and confidence. On a national or personal level self-centredness is a source of trouble.",[]
82740994168193024,1308561964,[],,865,4581,"If you treat people as brothers or sisters, they respond accordingly.",[]
22074824373,1282728405,[],,1081,6132,"There must be a way of promoting human values without involving religion, based on common sense, experience and recent scientific findings.",[]
23997724506,1284028243,[],,501,2577,I believe that our every act has a universal dimension.,[]
21216929344,1281860908,[],,345,1857,"Giving is recognized as a virtue in every major religion and in every civilized society, and it clearly benefits both giver and receiver.",[]
486079674364076033,1404725399,[],,6598,8433,"Compassion is a source of happiness, while self-centerdness can lead ultimately to violence.",[]
149072468030664704,1324376620,[],,822,4238,"We need awareness of the ways we are connected with others, reflecting on the characteristics we share with others.",[]
619438524895469568,1436520627,[],,6879,5645,"The gun may seem more decisive in the short term, but in the long term the power of truth is stronger.",[]
15246175150,1275479832,[],,28,70,Some photos of HHDL's teachings at TCV in Dharamsala on 1st and 2nd June. http://bit.ly/dtuDJx,[]
10203822861,1268106116,[],,39,312,"March 10th is the 51st anniversary of Tibetan Uprising Day, commemorating the 1959 Tibetan uprising in Lhasa against the Chinese in Tibet.",[]
51215504009998336,1301045702,[],,68,275,HHDL talks about unbiased compassion during a Q&A session with Thai Buddhists in Dharamsala on March 15th. http://youtu.be/ThgZpUlvgqY,[]
444405269007585280,1394789447,[],,5878,6716,Even people opposed to religion need calm minds and compassion to make their work more effective.,[]
20618789782,1281261644,[],,936,3874,"Anger, jealousy, impatience, and hatred are the real troublemakers, with them problems cannot be solved.",[]
121166184107343873,1317723244,[],,71,396,His Holiness the Dalai Lama calls of visit to South Africa. http://t.co/DIEkPU4d,[]
155240636457566209,1325847226,[],,1344,6339,The essence of compassion is a desire to alleviate the suffering of others and to promote their well-being.,[]
116073642525335552,1316509087,[],,49,240,"In a letter to Sikkim's Chief Minister, HHDL expressed his concern for the devastation caused by the recent earthquake. http://t.co/BS77SJir",[]
11921551279,1270875196,[],,19,63,The Mind and Life XX Conference Starts in Zurich http://bit.ly/beWlgV,[]
16135861001,1276508843,[],,484,2087,"Love and compassion open our own inner life, reducing stress, distrust and loneliness.",[]
17890073617895424,1293100300,[],,270,957,"I believe that our underlying or fundamental nature is gentleness, and intelligence is a later development.",[]
172983697405001729,1330077502,[],,1386,7662,"If we seek happiness for ourselves, we should practice compassion: and if we seek happiness for others, we should also practice compassion.",[]
9614551489,1267079015,[],,14,61,Webcast: His Holiness Meets with South Florida Media http://bit.ly/bi7z6L,[]
16683257669,1277115235,[],,52,80,Watch HHDL talk on promoting secular ethics to a group of Japanese Buddhists on June 20th. http://www.youtube.com/watch?v=Sugk-fHlzIc,[]
133490049902845952,1320661482,[],,3041,11448,The true hero is one who conquers his own anger and hatred.,[]
29556599441,1288777875,[],,1906,9804,I am convinced that everyone can develop a good heart and a sense of universal responsibility with or without religion.,[]
191819089407262720,1334568209,[],,1803,9587,Having a more compassionate attitude helps you communicate more easily with your fellow human beings.,[]
251252400193687552,1348738214,[],,2147,8374,I like to point out that our nature is basically compassionate because we are social animals. What brings us together is love and affection.,[]
329165176798593024,1367314068,[],,7540,19566,"Most of our problems are related to the mind, so we have to work to reduce our destructive emotions.",[]
178066603223695362,1331289361,[],,899,4737,Common sense shows you the value of warmheartedness.,[]
191154505465864192,1334409760,[],,138,475,Short video clip of HHDL being welcomed on his arrival in Hawaii on April 13th. http://t.co/rbpzEzb9,[]
89626939496734720,1310203702,[],,160,469,HHDL talks about making the most of each new day in this clip from his 76th birthday celebrations on July 6 http://t.co/eEbogUb,[]
10670696756,1268918658,[],,58,272,Freedom Must for Human Creativity http://bit.ly/dxgtjB,[]
221177523164282881,1341567805,[],,791,1305,HHDL is greeted by well-wishers as he arrives for celebrations honoring his 77th birthday in Dharamsala on July 6  http://t.co/NbkyQUJq,[]
28582548052,1287914557,[],,650,3014,All individuals are equal in that every one of us instinctively seeks happiness and avoids suffering.,[]
202332674248032256,1337074843,[],,266,528,Dr. John M. Templeton Jr. presents the 2012 Templeton Prize to HHDL at St. Paul’s Cathedral in London on May 14th. http://t.co/PohO0O2o,[]
402382705393795072,1384770487,[],,2184,1914,"HHDL is greeted by students on his arrival at Yakumo Academy, a girl’s school in Tokyo, Japan on November 18th http://t.co/HNIlDS8ICk",[]
324455085079928832,1366191095,[],,258,612,"Live: HHDL’s talk on “The Culture of Compassion” from Derry, UK, on April 18th starting at 1:00pm BST http://t.co/aohWJnnuJ5",[]
611843417551704064,1434709812,[],,9300,8919,"A truthful, compassionate attitude is a sign of strength. It’s lying and anger that betray weakness.",[]
176976418591346688,1331029440,[],,159,521,"Live Webcast: HHDL will teach on the Jataka Tales from the Main Tibetan Temple in Dharamsala, India, on March 8th. http://t.co/BbV09Vqy",[]
12451906500698112,1291803740,[],,626,3301,Even modern medical researchers have come to the conclusion that peace of mind is vital for good health.,[]
458175989495762944,1398072643,[],,8306,10321,It is always helpful to remain honest and truthful in the face of difficulty.,[]
140013473882062848,1322216788,[],,1640,7209,"Developing inner values is much like physical exercise. The more we train our abilities, the stronger they become.",[]
206683081518743552,1338112061,[],,446,712,"HHDL speaking at the European Solidarity Rally for Tibet at the Vienna Heldenplatz in Vienna, Austria, on May 26.  http://t.co/PJAiWjlp",[]
28675148997,1287999546,[],,789,3141,"A compassionate person creates a warm, relaxed atmosphere of welcome and understanding around him.",[]
370115484596703232,1377077382,[],,6702,15770,"Blessings don’t come from outside, but from within. Whatever blessings we receive are the result of our own efforts and positive actions.",[]
23224536953,1283853554,[],,327,1642,"When in our interactions with our neighbors we are open and sincere in everything we say and think and do, people have no need to fear us.",[]
454551924574928896,1397208598,[],,7761,9221,"We need to see that anger is never any use in solving problems, but that patience and compassion are helpful.",[]
538278810269913088,1417170643,[],,10080,11767,Even small acts of compassion bring meaning and purpose to our lives.,[]
12875999835,1272278988,[],,605,2256,"Determination, courage, self-confidence are keys to success. In all circumstances, we should remain humble, modest and without pride.",[]
487529910844411904,1405071163,[],,5236,6320,"There needs to be a systematic approach to introducing inner values, a warm-hearted concern for all human beings, into education.",[]
222258734062256128,1341825586,[],,1499,7348,A good way to work for a more peaceful world is to develop concern for others.,[]
540815513664774145,1417775440,[],,6543,6304,"I believe that human nature is fundamentally positive and gentle; therefore, a human approach should be non-violent.",[]
201233678712569856,1336812822,"[""tempprize""]",,88,403,"Live Webcast: 2012 Templeton Prize will be awarded to HHDL at St. Paul's Cathedral in London, UK, on May 14 http://t.co/LenGJAM6 #TempPrize",[]
45760714983489536,1299745179,[],,180,1035,Statement of His Holiness the Dalai Lama on the 52nd Anniversary of the Tibetan National Uprising Day http://bit.ly/fO7i8R,[]
23901565385,1283940383,[],,515,2816,"Compassion is the foundation of a good heart, the heart of one who acts out of a desire to help others.",[]
222978874286419969,1341997281,[],,1867,8418,"We need to relate to each other out of compassion, with a sense of connection to each other and a deep recognition of our common humanity.",[]
267937190607216640,1352716178,[],,2377,9121,Past history clearly shows that violence cannot solve problems.,[]
10444983389,1268525544,[],,424,1634,"If you have a sense of caring for others, you will manifest a kind of inner strength in spite of your own difficulties and problems.",[]
93982910864048128,1311242246,[],,1270,4818,"To control negative physical and verbal actions, it is necessary to get at their root, the mind, and tame it.",[]
23047299834,1283680054,[],,513,2267,"By being inattentive to the needs of others, inevitably we end up harming them.",[]
10212717739,1268124446,[],,34,81,Video clip of HHDL speaking to some Vietnamese Buddhists last Sunday on peace of mind from a Buddhist perspective. http://bit.ly/dz7riC,[]
76580831338045440,1307093267,[],,2436,9550,"We should value our enemies because they provide us with unique opportunities to practice patience, tolerance and forbearance.",[]
24892919735,1284857424,[],,55,185,"Mayor Gabor Demsky of Budapest confers Honorary Citizenship upon HHDL on September 18th, 2010. http://twitpic.com/2psrcb",[]
378450304716374016,1379064558,[],,2199,5534,In order to derive the maximum benefit the wise thing is to take care of others.,[]
25769637253,1285666142,[],,619,3321,From adversity we can learn the value of patience.,[]
530306195374886912,1415269824,[],,5870,7024,"Affection, a sense of community and a sense of concern for others are not some kind of luxury. They’re about the survival of humanity.",[]
337863003963813888,1369387791,[],,4609,11929,It is expressions of affection rather than money and power that attract real friends.,[]
175520640038744064,1330682356,[],,1737,8798,Generosity is the most natural outward expression of an inner attitude of compassion and loving-kindness.,[]
24923581578,1284890327,[],,392,1845,All human endeavor is potentially great and noble - so long as we carry out our work with good motivation.,[]
138920322287157248,1321956160,[],,762,4036,"Compassion, along with love, is the face of altruism.",[]
15620157706,1275906484,[],,45,91,"Photos of HHDL's visit to the remote Himalayan region of Paddar in Jammu & Kashmir, India, on June 5th, 2010. http://bit.ly/aZzLpP",[]
529219119904616449,1415010645,[],,6378,7040,Cultivating a genuine sense of concern for others’ well-being is the basis for the trust that makes happiness and friendship possible.,[]
399122524232904704,1383993199,[],,435,544,"Live Webcast: HHDL's one day teaching on ""Three Principal Aspects of the Path"" in Dharamsala, India on November 11. http://t.co/sAB4RqUUHw",[]
15478252732,1275731258,[],,313,1356,I believe that we are fundamentally the same and have the same basic potential.,[]
10114075437,1267954364,[],,377,1790,"I believe that, fundamentally, human nature is positive, gentle; therefore, the non-violent way is the human way.",[]
312135941416431616,1363253982,[],,1227,3087,His Holiness the Dalai Lama congratulates the new Pope http://t.co/lS6I0BEayp,[]
259224461696446464,1350638902,[],,377,716,"HHDL talks about healthy mind and body in this short clip from his talk at The College of William &amp; Mary, October 10. http://t.co/VpsB0Rrd",[]
21738139217,1282384753,[],,957,3937,"If we have no inner peace, we deceive ourselves into thinking that comfort and prosperity will bring happiness.",[]
582475249553317888,1427707896,[],,8910,8820,"When our mind is calm, we’re better able to find peace of mind and live a joyful life.",[]
12091668081680385,1291717852,[],,801,3313,"Once you encourage the thought of compassion in your mind, once it becomes active, then your attitude towards others changes automatically.",[]
552774717858267136,1420626737,[],,860,1325,"Short clip: HHDL answers a question from a young student on compassion at MIT in Cambridge, MA, USA on Oct 31, 2014 http://t.co/NhEmgwc8sd",[]
9913501649,1267598617,[],,12,57,Tibetan Administration Offers Long-Life Puja for HH the Dalai Lama http://bit.ly/cEKZUR,[]
9711661217,1267241051,[],,52,182,"Live webcast of His Holiness's teaching on the Life Stories of the Buddha, 28 Feb 8:30am IndianStandardTime (GMT+05:30) http://bit.ly/arFvaw",[]
75134594717978624,1306748457,[],,1114,5649,"The most important thing is to have a sense of responsibility, commitment, and concern for each of our fellow human beings.",[]
633586701605171200,1439893815,[],,9554,8801,"Compassion reduces our fear, boosts our confidence, and opens us to inner strength.",[]
463974236152147969,1399455052,[],,485,540,"Live webcasts of HHDL's teaching and public talk from Oslo, Norway on May 8-9, 2014. http://t.co/Z0Al6NVdin",[]
10568442343,1268744177,[],,12,58,"HHDL left Dharamsala today for Bhopal, India where he will speak on human rights and universal responsibility tomorrow at the State Assembly",[]
92907722214883328,1310985901,[],,1215,6074,"If we find we cannot help others, the least we can do is to desist from harming them.",[]
100525523071016960,1312802127,[],,1453,7488,A calm and peaceful mind is something very essential.,[]
531031016329064448,1415442635,[],,610,522,"Live Webcasts: HHDL's teaching on Nagarjuna's ""Precious Garland"" from Dharamsala, India on November 11-13. http://t.co/sAB4RqUUHw",[]
535742218850430976,1416565873,[],,6463,6984,"Affection, warm-heartedness, that makes us happy; wealth alone can’t do that.",[]
22693791807,1283334352,[],,208,1047,I am encouraged by the clear acknowledgment of the need to seek non-violent resolutions of conflict in a spirit of reconciliation.,[]
550962415618113536,1420194650,[],,19481,15695,"Without technology humanity has no future, but we have to be careful that we don’t become so mechanised that we lose our human feelings.",[]
321193103644037121,1365413378,[],,3444,9391,"Concern for others’ well being reduces fear and suspicion, prompting the openness and transparency that gives rise to trust and friendship.",[]
237481569810518016,1345454993,[],,2664,10284,I have found that the greatest degree of inner peace comes from cultivating love and compassion.,[]
276996620434956288,1354876115,[],,2449,9105,"By implementing the practice of love and compassion, we will naturally live a non-violent way of life.",[]
634673577178959872,1440152947,[],,6138,5830,"The use of force and violence inevitably entails unanticipated consequences, but rarely yields a solution.",[]
12037951406,1271065454,[],,181,744,Striving gradually to be more compassionate is to develop genuine sympathy for others’ suffering and the will to help remove their pain.,[]
13180256097,1272706174,[],,277,1095,"As idealistic as it may sound, altruism, not just competition and the desire for wealth, should be a driving force in business.",[]
20962980323,1281606768,[],,620,3162,It is worth reminding ourselves that the greatest joy and satisfaction in life come from actions we undertake out of concern for others.,[]
273011045948338177,1353925880,[],,6059,17899,I always try to share with others the idea that in order to become compassionate it is not necessary to become religious.,[]
63176845734051840,1303897508,[],,956,4234,"Compassion and love are the source of all spiritual qualities: forgiveness, tolerance, all the virtues.",[]
16683711718,1277115906,[],,195,940,"Moral ethics are not a matter of religion alone, a secular approach needs to given, so that they become more universal.",[]
576314276228390912,1426239005,[],,5968,6440,"Compassion is not just the business of the religious; it is important to know it’s everyone’s business, it is a question of human survival.",[]
212112889803317248,1339406628,[],,2701,9497,"When, from the depths of your heart, you spontaneously wish all beings to find true, lasting happiness, this is great love.",[]
60272096445603840,1303204962,[],,1103,4538,"When we develop patience, we find that we develop a reserve of calm and tranquility.",[]
263943983431049216,1351764124,[],,168,539,His Holiness the Dalai Lama's concern about events in Burma http://t.co/YuLaUO9M,[]
14482923690,1274517353,[],,353,1569,A secular person can be spiritual: compassion is for everyone to practice.,[]
26077380569,1285938263,[],,736,3125,Lack of contentment sows the seed of envy and aggressive competitiveness and leads to a culture of excessive materialism.,[]
489703710059003904,1405589437,[],,5948,7629,"We need cooperation based on trust and self-confidence to create an open, compassionate, harmonious society.",[]
195452392177799168,1335434456,[],,1196,6643,"Just as we need good physical health  we also need strength of mind to 
ensure our well-being; and we develop it by cultivating ethics.",[]
19741955025,1280325018,[],,578,3045,"The most compassionate form of giving is done with no thought or expectation of reward, and grounded in genuine concern for others.",[]
569806477583458304,1424687425,[],,6463,7396,Affection and compassion are indispensable in daily life.,[]
28568014689,1287897401,[],,45,192,"Live: HHDL in Toronto, Mind Training teaching & Long Life Empowerment/Ceremony October 24, 9am-4pm. http://www.dalailamatoronto2010.org/",[]
118619910770409472,1317116165,[],,94,386,His Holiness the Dalai Lama offers condolences to the family of fellow Nobel Laureate Wangari Maathai. http://t.co/Kk2gazNm,[]
203780720324378624,1337420084,[],,87,416,"HHDL will speak at the European Solidarity Rally for Tibet in Vienna, Austria, on May 26th. http://t.co/gwSO5tfo",[]
12388480984,1271580218,[],,300,1233,"Since we are not solely material creatures, it is a mistake to place all our hopes for happiness on external development alone.",[]
90714028070014976,1310462884,[],,1132,3801,Taking a realistic view and cultivating a proper motivation can also shield you against feelings of fear and anxiety.,[]
