tweet_id,time,hashtags,type,faves,retweets,text,mentions
372652163106742272,1377682173,"[""dreamday""]",,723,1673,"HHDL speaks about his dream on the 50th anniversary of Martin Luther King Jr.'s ""I Have a Dream"" speech. #DreamDay http://t.co/l9dZfDAcyM",[]
161392471165775872,1327313938,[],,1636,9302,The human capacity to care for others isn’t something trivial or something to be taken for granted. Rather it is something we should cherish,[]
435723415148707840,1392719532,[],,367,442,"Live: Panel discussions with HHDL hosted by the American Enterprise Institute in Washington, DC on February 20th. http://t.co/sAB4RqUUHw",[]
473395961146781696,1401701367,[],,516,489,"Live Webcasts: HHDL's teachings from Tibetan Childrens' Village School (TCV) in Dharamsala, India on June 4-6. http://t.co/sAB4Rrd3VE",[]
223709810472927232,1342171549,[],,3226,13956,"A calm mind is good for our physical health, but it also enables us to see things more realistically.",[]
648429542202191872,1443432624,[],,15003,13332,"Many think that happiness is to be found outside ourselves in material things, but actually happiness is something that comes from within.",[]
26733736502,1286531359,[],,1274,4699,"If you have a sincere and open heart, you naturally feel self-worth and confidence, and there is no need to be fearful of others.",[]
157763632518803456,1326448755,[],,926,5995,"If the twentieth century was a century of violence, let us make the twenty-first a century of dialogue.",[]
137109025581047808,1321524313,[],,1797,9622,"Even more important than the warmth and affection we receive, is the warmth and affection we give.",[]
10656306204,1268887782,[],,17,61,"Photos of HHDL's visit to Bhopal, India, yesterday, March 17th. http://bit.ly/ceCByR",[]
104482882940186626,1313745635,[],,676,3766,We must work to resolve conflicts in a spirit of reconciliation and always keep others' interests in mind.,[]
29071619943,1288344945,[],,687,2765,"Unlike physical progress, which is subject to natural restrictions, the qualities of the mind can be developed limitlessly.",[]
15346180774957056,1292493789,[],,435,2230,"Not only do we inherently possess the potential for compassion but I believe that the basic, underlying nature of human beings is gentleness",[]
134571737286328320,1320919377,[],,3125,14204,"Appreciate how rare and full of potential your situation is in this world, then take joy in it, and use it to your best advantage.",[]
17859626659,1278414122,[],,41,283,"Some photos of HHDL attending ceremonies held in Dharamsala, India, to celebrate his 75th birthday on July 6th. http://bit.ly/8XR3uF",[]
25198435054,1285149674,[],,582,2619,"When we reach beyond the confines of narrow self-interest, our hearts become filled with strength.",[]
11475943741,1270207743,[],,371,1497,Only the practice of tolerance and patience can give protection from the destructive effects of anger and hatred.,[]
96521578505969664,1311847512,[],,688,3897,It seems wrong to think kindness is exclusively the business of religion; something to be neglected if one isn’t interested in spirituality.,[]
405283685756174336,1385462135,[],,7725,13875,"Sometimes things go wrong; that’s normal. But we have a saying in Tibetan, ‘Nine times fail, nine times try again'.",[]
13967239944,1273830295,[],,385,1708,"If you have love and compassion towards all living beings, particularly toward your enemy, that is true love and compassion.",[]
145085964585418752,1323426164,[],,93,295,"Live webcasts: HHDL's public talk, discussion and press conference from Prague, Czech Republic, on December 11-12. http://t.co/BbV09Vqy",[]
615452176740016128,1435570208,[],,10162,9002,"We all want to be happy and avoid suffering, and we all have a right to be happy. That’s why I say we are all the same.",[]
28014254262,1287657215,[],,881,4216,"By studying others’ viewpoints, it is possible for us to discover new and refreshing perspectives on the world – including our own life.",[]
579938206914732032,1427103017,[],,7132,6938,One of our best human qualities is intelligence; it enables us to judge what is beneficial and what brings harm.,[]
517969969359769600,1412328638,[],,6104,6976,Our intelligence needs to be guided by warm-heartedness.,[]
29456045862,1288692131,[],,477,1860,The efforts we make sincerely to transform ourselves spiritually are what make us genuine practitioners.,[]
650966201196109825,1444037411,[],,11350,10561,"The future is in your hands, but for it to be peaceful and happy requires a sense of compassion and concern for others’ well-being.",[]
37827795308658688,1297853823,[],,948,4034,"Friends and enemies do not exist as such; friendship and enmity depend on many factors, of which the primary one is our own mental attitude.",[]
21128924190,1281765715,[],,43,373,"His Holiness the Dalai Lama prays for the loss of life caused by floods in Pakistan, India, and landslides in Drugchu http://bit.ly/aHO6DW",[]
14544970755,1274602043,[],,442,1651,"People who are compassionate, loving, patient, tolerant and forgiving recognize their impact on others and order their conduct accordingly.",[]
119335091947307008,1317286677,[],,93,244,"Live Webcasts: HHDL's teachings on Nagarjuna's ""In Praise of Dhammadhatu"" from Dharamsala, India, on October 1-4. http://t.co/BbV09Vqy",[]
86004532471009280,1309340053,[],,1441,8466,We all have the right to lead happy lives.,[]
220811437323452416,1341480523,[],,178,689,"Live Webcast: HHDL's 77th Birthday Celebrations from the Main Tibetan Temple in Dharamsala, India on July 6th.. http://t.co/V0p2Ho9o",[]
24429861010,1284424640,[],,43,197,Images of HHDL's trip to Ladakh to visit flood damaged areas and join in prayers for the victims on September 13th. http://bit.ly/aTUd0D,[]
466873368479023104,1400146259,[],,6633,8667,"The more we are concerned for the well-being of others, the closer we will feel to each other.",[]
22233184938754049,1294135779,[],,562,2349,"To increase our altruism, we must motivate ourselves to take into consideration the effects of our actions both in the present and future.",[]
167554074152140800,1328782978,[],,83,434,"Live Webcast: HHDL welcomes Archbishop Desmond Tutu to Dharamsala, India, on February 10 at 10:30-11:30am Indian Time http://t.co/Xl8neIyi",[]
118255708289507328,1317029332,[],,1973,8854,The nature of our motivation determines the character of our work.,[]
36367390593785856,1297505636,[],,812,4536,I would like to say that the very root of respect for human rights and nonviolence is love and kindness to others,[]
124414422935552000,1318497684,[],,1179,6395,"Affection, honesty, harmony and non-violence are qualities that yield happiness for individuals, families and society at large.",[]
177341204793536513,1331116412,[],,827,4775,"The more adept we are in cultivating altruism, the happier we will be and the better the atmosphere we will create around us.",[]
386785410006790145,1381051802,[],,612,742,"Live webcasts: HHDL's talks, teaching and discussions from Emory University in Atlanta, Georgia, USA on October 8-10 http://t.co/Wx96aZ6FRf",[]
670590181351809024,1448716132,"[""climateaction"", ""tibet"", ""roofoftheworld"", ""cop21"", ""adp2015""]",,3334,2231,This planet is our home and Tibet its roof. We need #climateaction for #Tibet - the #RoofOfTheWorld #COP21 #ADP2015 https://t.co/5JsgkUwfLb,[]
84866379852955648,1309068696,[],,89,292,"Live Webcast: HHDL's teaching on ""Praise to Dependent Origination"" from Dharamsala, India, June 28-29. http://t.co/4TLodpo",[]
10821267667,1269179548,[],,8,38,"Some photos of HHDL's visit to Vivekananda foundation in New Delhi on March 20th, 2010http://bit.ly/9X8WlT",[]
22873937739,1283506819,[],,367,2408,"Through developing an attitude of responsibility toward others, we can begin to create the kinder, more compassionate world we all dream of.",[]
377725484634615808,1378891747,[],,198,407,"Live Webcasts: HHDL's talks, teachings and discussions from Lithuania and the Czech Republic on September 12-16. http://t.co/sAB4RqUUHw",[]
585011657597849601,1428312622,[],,8904,7813,It’s clear that the ultimate source of happiness is warm-heartedness.,[]
380986982886674432,1379669349,[],,4861,11437,Use your human intelligence in the best way you can; transform your emotions in a positive way.,[]
16839597276,1277287727,[],,279,1385,The practice of compassion is the most effective way to pursue the best interests of others as well as our own,[]
379899937799933952,1379410178,[],,3862,8537,"Fear that makes us run from a mad dog is useful and necessary, whereas fear rooted in mistrust is unhelpful and needs to be overcome.",[]
436448978071060480,1392892519,[],,540,642,"HHDL will talk on ""Non-Violence and the Effects of Compassion in the 21st Century"" at the Forum in Los Angeles Feb 25 http://t.co/wdXc7eBsEp",[]
450928231869210625,1396344642,[],,5109,5058,"When you are concerned for the welfare of others, bullying and exploitation cease.",[]
18249616508067840,1293186022,[],,809,4234,"It is clear that feelings of love, affection, closeness and compassion bring happiness.",[]
12938400947,1272365251,[],,188,1002,"The practice of non-violence suits us all, it only calls for determination. If it succeeds, it can open the way to a far more peaceful world",[]
620525601103998976,1436779806,[],,5498,4577,The greatest threat we face today is violence.,[]
11721709115670528,1291629647,[],,525,2052,"Looking at the pattern of our existence from birth to death, we can see the way in which we are fundamentally nurtured by other's affection.",[]
229877332968632320,1343642001,[],,3543,11623,Don't blame others for your uneasy feelings; blame your own state of mind. This is why altruism  brings you greater peace of mind.,[]
10061980178,1267854839,[],,47,92,Video of HHDL in conversation with Dave Matthews and Ann Curry in 2008 at the Seeds of Compassion event in Seattle http://bit.ly/c5iXo1,[]
90351201736065024,1310376379,[],,1513,7565,"Whether we like it or not, we're all connected, and it is unthinkable to be happy all by oneself.",[]
83102972086718464,1308648267,[],,729,2983,"When you have moistened your mind with love, you can begin to meditate on compassion.",[]
121151231837208576,1317719679,[],,715,3258,"Through thoughtful contemplation, coming to appreciate compassion and love, our mental attitudes can gradually change.",[]
224797477663014912,1342430869,[],,1250,5862,People in every part of the world are fed up with violence; increasingly people are looking for ways to create peace.,[]
10568469811,1268744224,[],,155,798,"General standards of human rights apply to all countries because all humans share an inherent yearning for freedom, equality and dignity.",[]
13479592959,1273141333,[],,913,3259,"If you wonder what you were doing in the past, look at your body; to know what will happen to you in the future, look at your mind.",[]
600247109485338624,1431945037,[],,6838,6102,"Common sense tells us we‘ll be happy even if we’re poor if we’re warm-hearted, whereas if we’re wealthy but self-centred we’ll be miserable",[]
12273491316,1271409711,[],,10,48,HHDL traveled to Delhi today to deliver the 3rd Annual Mother Teresa Memorial Lecture at Indira Gandhi National Open University.,[]
23127507189,1283759763,[],,66,176,"Live:HHDL teaches Heart Sutra & 37 Practices, Sept 8-10, 9:30-11:30am & 1:00-3:00pm IndianStandardTime GMT+5.30 http://dalailama.com/liveweb",[]
9769059931,1267345118,[],,47,127,Webcast: Life Stories of the Buddha http://bit.ly/cJDNo8,[]
91438708645040128,1310635661,[],,765,3612,The very purpose of spiritual practice is to help others.,[]
251614277641838593,1348824493,[],,255,552,"Live Webcasts: HHDL's teachings on Atisha's ""Lamp for the Path to Enlightenment"" from Dharamsala, India on October 1-4 http://t.co/BbUVClpE",[]
248352694274772992,1348046871,[],,4609,17709,"In order to lead a meaningful life, you need to cherish others, pay attention to human values and try to cultivate inner peace.",[]
28672311790,1287996058,[],,56,207,"Live Webcast: HHDL at University of Miami: The Quest for Happiness in Challenging Times - October 26, 1:30pm EDT http://miami.edu/dalailama/",[]
422676846614818816,1389608987,[],,4619,7343,"We need a sense of belonging to one humanity, respecting the rights and views of others.",[]
484588249948160,1288950509,[],,688,3107,"If you use violence, you may get some temporary satisfaction. But the nature of violence is unpredictable - unexpected results often happen.",[]
384248524562395136,1380446961,[],,258,455,Live: HHDL's teaching on 60 Stanzas of Reasoning &amp; Path of the Stages of Enlightenment from India on Sept 30 - Oct 3 http://t.co/sAB4RqUUHw,[]
27211798172,1286944757,[],,67,224,"Live webcast: HHDL at Stanford Univ. ""The Centrality of Compassion in Human Life and Society"" Oct 14 at 9:30-11am PDT http://bit.ly/9uiNtx",[]
40342246217752576,1298453315,[],,821,4610,"If we want to help humanity in a practical way, we must begin by setting an example of mutual respect, harmony and cooperation.",[]
72957809158930432,1306229471,[],,1233,6128,Only through kindness and love can peace of mind be achieved.,[]
13362555153,1272976820,[],,426,1900,You can develop patience and change your attitudes with continuous practice - the human mind has such potential.,[]
26593220930572288,1295175292,[],,68,291,"Photo of HHDL waving to the audience before his teachings in Sarnath, India, on January 15th, 2011.                http://twitpic.com/3qjsiv",[]
100133941448683521,1312708766,[],,854,4742,"The message of love and compassion will travel far and wide if all
who follow a spiritual path work together in harmony and mutual respect.",[]
331702115246428161,1367918921,[],,2163,5885,Serving and helping others out of compassion is non-violence in action.,[]
185660217357373440,1333099819,[],,1517,7856,Compassion is a mental quality that can bring us true lasting inner peace and inner strength.,[]
3750924078026752,1289729264,[],,1577,5903,"Every day, when you get up, you can develop a sincere positive motivation: I will utilize this day in a more positive way.",[]
68248034684833792,1305106574,[],,1448,6718,"When our intentions are good, we are stronger and have greater self-confidence.",[]
112810195553484800,1315731021,[],,151,1366,"HHDL’s message “After Sept. 11, yearning for peaceful co-existence” http://t.co/i2ddIiG",[]
10710796323,1268980843,[],,357,1643,"With money you can't buy wisdom, you can't buy inner peace. Wisdom and inner peace must be created by yourself.",[]
15164790341,1275381130,[],,744,2832,"When we act under the influence of negative thoughts and emotions, we become oblivious to the impact our actions have on others.",[]
154151370251972608,1325587525,[],,1754,9019,"While revenge weakens society, forgiveness gives it strength.",[]
449840870284488704,1396085395,[],,1495,623,"Live Webcast: HHDL will bestow the Medicine Buddha Empowerment from Dharamsala, India on March 31st. http://t.co/sAB4Rrd3VE",[]
108492687493173248,1314701647,[],,1138,6401,"The more contact we have with one another and the more we come to understand each other’s values, the greater will be our mutual respect.",[]
205957601031241728,1337939093,[],,2441,8685,Cultivating inner discipline is something that takes time; expecting rapid results is simply a sign of impatience.,[]
413990697130160128,1387538048,[],,339,416,"Live: HHDL’s teaching on Shantideva’s “Guide to the Bodhisattva’s Way of Life” from New Delhi, India, December 21-22. http://t.co/sAB4RqUUHw",[]
376638502919610368,1378632591,[],,303,584,"Live Webcast: HHDL's talk ""The Culture of Compassion"" from Riga, Latvia on September 9th starting at 1:30pm CEST http://t.co/5c2MkGO3ef",[]
106662440187596800,1314265282,[],,1304,6513,"The point of our existence is that, as human beings, we live purposeful, meaningful lives.",[]
185309979291561985,1333016316,"[""tempprize""]",,147,755,"HHDL wins the 2012 Templeton Prize, honored for encouraging scientific research and harmony among religions http://t.co/bmWeVQYS #tempprize",[]
9573375189,1267014129,[],,19,106,His Holiness the Dalai Lama in Florida - 23 February 2010 http://bit.ly/c5nrf4,[]
194006059516559360,1335089623,[],,102,402,"Live Webcasts with HHDL from the Mayo Clinic and 12th World Summit of Nobel Peace Laureates on April 23-25, 2012. http://t.co/BbV09Vqy",[]
146172993909956609,1323685332,[],,1682,7708,"With inner strength or mental stability, we can endure all kinds of adversity.",[]
161757451652317184,1327400956,[],,2316,9752,"So long as we are under the control of disturbing emotions, real happiness is hard to find.",[]
416516341462343680,1388140208,[],,5633,9140,"In order to exercise creativity, freedom of thought is essential.",[]
459627096055095296,1398418613,[],,10224,12560,"As a human being, I believe each one of us should have some concern for others and for the planet.",[]
7002267098025984,1290504445,[],,707,3430,"We need to make an effort to develop our inner values, irrespective of whether we are religious or not.",[]
20542269398,1281176352,[],,23,140,Live: HHDL in dialogue with Delhi University students August 9-10 (9:30am & 1:30pm IndianStandardTime - GMT+5.30). http://dalailama.com/live,[]
88906107464065024,1310031842,[],,93,384,HHDL addresses the audience during celebrations in honor of his 76th birthday held in Washington DC on July 6th.   http://twitpic.com/5mfoti,[]
14479475184,1274511089,[],,16,110,"Live: HHDL addresses the Tibetan community in New York, May 22nd, starting at 8:00am EDT (5:30pm India, 8:00pm Tibet) http://www.tcnynj.org/",[]
9556068919,1266978556,[],,18,103,Dalai Lama Addresses Students in Broward http://bit.ly/chAdIM,[]
127318124105183232,1319189980,[],,1324,6123,"Compassion is the wish to offer unbiased service to all beings, whether they are friendly or hostile to you.",[]
91800831724240896,1310721998,[],,84,315,"HHDL presents Cardinal Theodore Edgar McCarrick with a ""souvenir"", a Buddha statue, in Washington DC on July 14th. http://twitpic.com/5qf4bq",[]
9518119318,1266914702,[],,27,151,His Holiness the Dalai Lama Honored with NED Democracy Service Medal. Video Link http://bit.ly/bqOGpD,[]
52301239186239488,1301304561,[],,738,3106,"Due to the fundamental interconnectedness that lies at the heart of reality, your interest is also my interest.",[]
33456037105242112,1296811515,[],,1025,4759,We can't be useful to ourselves unless we're useful to others.,[]
116439172532809728,1316596236,[],,1152,4453,"The mind is definitely something that can be transformed, and meditation is a means to transform it.",[]
628150765303914496,1438597787,[],,10831,9861,"To create a happier humanity we have to pay more attention to our inner values, whether we are religious or not.",[]
17161122146689024,1292926505,[],,923,3887,Achieving genuine happiness may require bringing about a transformation in your outlook and way of thinking.,[]
629238072064937984,1438857021,[],,10331,6622,"Japan, the one country to have suffered nuclear attack, has taken the lead in opposing nuclear weapons. I strongly urge you to keep it up.",[]
25857113393729536,1294999790,[],,387,1781,"If we develop a good heart, then whether the field is science, agriculture or politics, since motivation is important these will all improve",[]
55926843311792128,1302168973,[],,676,3201,"Reflect on the value of inner versus outer wealth; in our world, there is a new awareness of our inner life and its worth.",[]
16646702235,1277070228,[],,41,138,"Some photos of the second day of HHDL's visit to Nagano, Japan, on June 20th. http://bit.ly/9xm0Tm",[]
586461120728186880,1428658201,[],,7483,6741,It is important to teach young people at school that violence is a fruitless approach to solving problems.,[]
12030980661,1271049549,[],,23,185,HHDL offers his condolences to the people of Poland for the loss of President Kaczynski and all the others who died in the tragic air crash.,[]
215359822315520001,1340180757,[],,1106,2342,"His Holiness the Dalai Lama with Aung San Suu Kyi during their private meeting in London, England, on June 19th.   http://t.co/GxRRRlUI",[]
15099174642,1275301716,[],,60,117,Live: Introductory teachings on Buddhism by HHDL at TCV June 1 and 2 at 9:00am Indian Standard Time (GMT+5.30) http://dalailama.com/live,[]
85649579147661312,1309255425,[],,1418,6514,"Being motivated by compassion and love, respecting the rights of others – this is the real practice of religion.",[]
236414194931621888,1345200511,[],,1661,8994,"We have to find ways to encourage non-violence, compassion and respect for others’ rights to achieve a better world in the future.",[]
17878059415,1278432733,[],,59,323,Watch HHDL's 75th birthday celebrations from Dharamsala. Speeches (in Tibetan) as well as cultural performances. http://youtu.be/0H-hxy0sqjA,[]
15840414023,1276164492,[],,483,1917,The greatest antidote to insecurity and the sense of fear is compassion - it brings one back to the basis of one's inner strength,[]
519057052363026433,1412587819,[],,4993,5512,Tackling destructive emotions like anger and hatred entails developing constructive emotions like love and compassion.,[]
409268473815003136,1386412182,[],,749,1054,"HHDL responds to the passing away of Nelson Mandela in this clip from his talk in New Delhi, India on December 6th. http://t.co/JbFq5x1BQ3",[]
374826747599917056,1378200635,[],,6834,13677,I’m optimistic that there is a growing appetite for peace in the world. Many young people are fed up with war and violence.,[]
98682445427257344,1312362703,[],,1325,5750,"Whatever steps, however small, one can take towards learning to reduce the influence of the negative emotions can be very helpful.",[]
274098017395687425,1354185034,[],,2681,8481,On a simple level we find that if we have a compassionate heart we naturally have more friends.,[]
641196792525160448,1441708202,[],,22692,21727,It's unrealistic to think that the future of humanity can be achieved through prayer or good wishes alone; what we need is to take action.,[]
25012123303,1284976297,[],,851,4129,"If we change inside and disarm ourselves by dealing constructively with negative thoughts and emotions, we can literally change the world.",[]
294385812446015488,1359022021,[],,3626,12009,"We need not only a trained intelligence, but also a warm heart. Then a sense of community and a sense of responsibility will arise naturally",[]
116802240823558144,1316682798,[],,616,2496,My number one commitment is to promote inner peace based on warm heartedness.,[]
216099263946563584,1340357054,[],,2419,10137,"A genuine change must first come from within the individual, only then can he or she attempt to make a significant contribution to humanity.",[]
13902370395,1273739009,[],,21,95,"Here are some photos of HHDL in Bloomington, Indiana, USA, on May 11th and 12th http://bit.ly/a0tZEL",[]
67523598432219137,1304933855,[],,527,2394,A holistic view brings realistic action.,[]
7389722301177856,1290596821,[],,973,4414,A calm mind helps our human intelligence to assess the situation realistically.,[]
536829381381865472,1416825072,[],,4969,4315,My number one commitment is to extend awareness that peace of mind depends on our cultivating inner values.,[]
524130531353432066,1413797431,[],,7521,8629,It’s not just money we need to lead a happy life; more important is to find inner peace.,[]
22732859273904128,1294254910,[],,404,720,"Essay by HHDL ""Countering Stress and Depression"" originally published by Hindustan Times, India, on January 3rd, 2011. http://bit.ly/ha5KCn",[]
21886751542870016,1294053182,[],,1140,5180,Determination and hope are key factors for a brighter future.,[]
12156754494,1271242304,[],,320,1489,The need for love lies at the very basis of human existence. It results from the profound interdependence we all share with one another.,[]
241467824072175616,1346405390,[],,1457,6281,We need to understand that material development by itself it doesn’t bring peace of mind. This can only be developed within the mind.,[]
40698097973600256,1298538157,[],,110,701,"His Holiness the Dalai Lama expresses his sadness over the recent earthquake in Christchurch, New Zeland.http://bit.ly/hg0gfx",[]
72593731336945664,1306142668,[],,444,2161,"The quality of altruism is fundamental, in my opinion, and will fill our daily lives with serenity and happiness.",[]
60999277845020672,1303378335,[],,2029,10077,Developing love and compassion and reducing anger and spite is a universal activity which requires no faith in any religion whatsoever.,[]
9511730884,1266900110,[],,22,158,Photos: Visit to Los Angeles 2010 http://bit.ly/9OFHdb,[]
151607166829207552,1324980939,[],,1105,7175,To suppose that we can achieve peace through violence is altogether misguided.,[]
137858287843549184,1321702951,[],,423,731,"HHDL at the opening of the new hostel for disadvantaged children near Dharamsala, India, on November 19th, 2011.   http://t.co/KZnbrBjI",[]
24557166557,1284545331,[],,313,1708,Compassion and love constitute non-violence in action.,[]
20423128056332288,1293704227,[],,524,1952,"A skillful, balanced approach is helpful for one's physical and emotional health, and it applies to one's spiritual growth as well.",[]
122355175880003584,1318006721,[],,67,353,"Inaugural Desmond Tutu Peace Lecture: HHDL with Archbishop Tutu by live video link in South Africa, October 8, 10:30am. http://t.co/YYnop2z3",[]
94703539623964672,1311414058,[],,1487,6216,All good qualities must be sown and cultivated. We can’t expect to change overnight from an ordinary person into one with high realizations.,[]
109194253544067074,1314868913,[],,1993,7876,Happiness comes through taming the mind; without taming the mind there is no way to be happy.,[]
263574687093764096,1351676077,[],,6223,16395,"Ask yourself, what am I doing about my anger, my attachment, my pride, my jealousy? These are the things we should check in our daily lives.",[]
