tweet_id,time,hashtags,type,faves,retweets,text,mentions
322454333729959936,1365714078,"[""pixartrivia""]",,29,13,#PixarTrivia Answer: (local favorite) Fentons Creamery.,[]
566794029732757505,1423969201,[],,426,162,"Love, as told by Pixar: http://t.co/zs7A3qjVQ7 http://t.co/G3jVvOZ7sS",[]
243755753414983680,1346950875,"[""monstersinc3d""]",,91,342,The best scarers in Monstropolis won’t go down without a fright. #MonstersInc3D comes to theaters December 19! http://t.co/UsUaU5ch,[]
463740027277955072,1399399213,[],,715,771,It’s okay for dreams to be impractical; that’s why they’re dreams.,[]
30413291142516736,1296086068,[],rt:29815947107762177,0,146,"RT @whoiseyevan: Okay, world... You can thank me later. ""Premakes"" Up (1965) http://bit.ly/h1k4y9",[89896866]
262961861228630016,1351529967,[],,258,918,"Don't forget, the monsters are more afraid of you than you are of them.",[]
205014896503562240,1337714334,"[""bagpipehits""]",,17,41,Some inspiration for more #BagpipeHits titles: http://t.co/y2Kk5iFe RT @mrjamieeast: Haggis That’s Why They Call It the Blues,[14060308]
632293251676958720,1439585433,"[""d23expo"", ""insideout""]",,333,86,It's a meeting of the minds inside #D23EXPO. #InsideOut http://t.co/oyMe0HbpDM,[]
194962823347052545,1335317733,[],,109,430,"Pete Docter's next film is going to take you to a place you know, but you've never seen: the human mind. It will release June 19, 2015",[]
164049185581182977,1327947348,[],,58,99,It looks like the Pizza Planet truck is trying to tell you something... http://t.co/Lk2O1M7c,[]
567171515217895424,1424059201,[],,505,167,What your favorite Pixar short says about you: http://t.co/1SGTQrvCok http://t.co/9Ycp0HgN3t,[]
539879179593203714,1417552201,"[""toystorythattimeforgot""]",,408,227,"Whether you’ve been naughty or nice, you’re in for a treat w/ #ToyStoryThatTimeForgot tonight at 8|7c on @ABCNetwork! http://t.co/98rdFgydE6",[631478663]
622450779123777541,1437238804,"[""funday"", ""cars"", ""cars2"", ""theincredibles"", ""toystory3""]",,307,92,"It's showtime—celebrate @ABCFamily's #FUNDAY with #Cars, #Cars2, #TheIncredibles &amp; #ToyStory3 starting at 2:30|1:30c. http://t.co/iQzho9ca8M",[40105401]
83582187374526464,1308762521,[],,28,48,"And, oh yeah, about 50,000 individual feathers. http://di.sn/7e",[]
162234715154300929,1327514744,[],,29,68,Remy’s conscience takes the form of a celebrated chef. What form would your conscience take? http://t.co/MgbKnogd,[]
522539424866140160,1413418081,"[""toystoryofterror""]",,217,90,The mystery! The suspense! The toys! #ToyStoryOfTerror is on @ABCNetwork tonight at 8 p.m. ET/PT. http://t.co/pKpRPGj5Pp,[631478663]
186574462848737280,1333317792,[],,80,157,See any particularly clever April Fools’ Day pranks today? Here’s an oldie but goodie: http://t.co/VTvTH5GL,[]
226799002081955841,1342908070,"[""brave""]",,80,107,“But why a bear?” #Brave http://t.co/740zq9wv,[]
344212739981455361,1370901687,[],,372,531,"Pro Tip: Don’t worry about making it look real, just make it believable.",[]
237675462778834945,1345501220,[],,49,102,"“It’s a very malleable, messy, glorious process.” - Finding Nemo director @andrewstanton on writing",[34678147]
543586116889509889,1418436004,[],,433,160,Pete Docter gave fans the inside scoop on @PixarInsideOut in his live chat. ICYMI: http://t.co/9qPnetEzhP http://t.co/M1bY2Ad18E,[2774426570]
620993678853672960,1436891405,"[""insideout""]",,1111,453,"""I could listen to her stories all day."" –Joy #InsideOut http://t.co/6m3ueolMtK",[]
41919583191310336,1298829382,[],,103,104,RT @thecarpetbagger Video: A Rare Look Inside Pixar Studios http://nyti.ms/dT5q83,[16955436]
595996449671946240,1430931601,[],,632,253,Do not disturb. http://t.co/tJHguvEYJr,[]
204361381032632320,1337558524,"[""brave""]",,43,109,"The boisterous one, the rule-maker, the wild child, and the wee devils. Meet Merida's unique family in #Brave, 6/22:http://t.co/s0o8ev9Y",[]
542754348858867712,1418237695,"[""askinsideout""]",rt:542754154104377344,0,20,"RT @PixarInsideOut: .@bets_johnson More growing up generally. In the film, moving is a metaphor for growing up. #AskInsideOut","[2774426570, 467126078]"
596721337621708800,1431104428,[],,364,123,Looks like a sticky situation. http://t.co/BmFaiK93iG,[]
94451840116207617,1311354048,"[""sdcc""]",,15,33,Look out #SDCC! RT @TheDailyPostit Making plenty of post-its to stick around Comic-Con http://yfrog.com/ki18105095j,[2363852659]
288825265008832513,1357696283,[],,200,336,"Everyday objects can have a story all their own. Watch a clip from our newest short, “The Blue Umbrella”: http://t.co/u5gJqPp5",[]
56114205190926336,1302213643,[],,218,639,"TIP: Live with your eyes open. After all, details are essential to the believability of the worlds and stories you'll create.",[]
44894941658365952,1299538762,[],,42,126,Binoculars are the window to WALL•E's soul. http://yfrog.com/h2aefip,[]
412996544057454592,1387301023,"[""monstersu""]",,263,114,Congrats to the whole team: #MonstersU was nominated for best animated feature by the Critics' Choice Movie Awards!,[]
575793338315595777,1426114804,"[""toystory4""]",,296,182,"Rootin', tootin' news from the playset: Josh Cooley (@CooleyUrFaceOff) will co-direct #ToyStory4, debuting in 2017. http://t.co/tkcggO0zVT",[229193685]
552532562724528129,1420569003,[],,222,80,"""Tackling a hard problem brings energy into a group of people and gives you a sense of camaraderie."" —@edcatmull http://t.co/O2d4GYLVbj",[60644920]
481844276058685442,1403715602,[],,118,74,"Words of wisdom, as told by Up. http://t.co/PqnmYLioXo",[]
172802976690343936,1330034414,"[""changeyourfate"", ""brave""]",,91,397,Carving your own path in the world requires more than a dream. #ChangeYourFate. Be #Brave. http://t.co/P1kEaN35,[]
491976040710144000,1406131203,[],,1002,661,Preparation is everything. http://t.co/F9HYiwcYeq,[]
366658485984821248,1376253169,[],,88,71,"""I think as women at Pixar, they are about as impressive as they come."" -producer Lindsey Collins of her colleagues",[]
550010941308669953,1419967801,[],,577,330,"""The more we all help each other, the more we all benefit.""  —John Lasseter http://t.co/ewjvGONK2h",[]
243832914746425344,1346969271,"[""doryisms""]",,30,49,Think fast: what is one of your favorite #Doryisms?,[]
237308212263665664,1345413661,"[""findingnemo3d""]",,77,195,“Righteous! Righteous!” #FindingNemo3D http://t.co/tEi4h1X8,[]
504410473576796160,1409095803,"[""insidepixar""]",,351,167,"The recipe for success: one part hard work, one part attention to detail, and a heaping spoonful of fun. #InsidePixar http://t.co/Bpj5ymCWAy",[]
570697251930152961,1424899802,[],,459,150,Quiz: Which Pixar song describes your life? http://t.co/x5BCMOHjHa http://t.co/kq3Cpz8pfF,[]
598231937677860864,1431464583,"[""insideout""]",,364,145,"Step fright up to #InsideOut's Fear, voiced by Bill Hader:
https://t.co/7vUnRz5q6Q",[]
492708363437113344,1406305802,[],,323,115,We never tire of Cars Land puns at the @Disneyland Resort. It's engine-uity at its finest. http://t.co/c9Arb0Zr7Y http://t.co/j4JPKyTUwC,[12378512]
573211325196853248,1425499204,"[""toysoldierday""]",,785,457,Salute! It's #ToySoldierDay. http://t.co/uj6vgnMbZS,[]
597430926654775296,1431273607,"[""mothersday""]",,975,357,Rad news travels fast. It's #MothersDay! http://t.co/5kyra3Cdlz,[]
494135279243264000,1406646005,"[""insidepixar""]",,837,234,The ball is in our court. #InsidePixar http://t.co/TjIioW1vLL,[]
661965385361727490,1446659821,[],,470,122,Here's to the most extra-roar-dinary of friends. https://t.co/7nrmdksehq,[]
583456318364786688,1427941801,"[""aprilfools""]",,1101,500,"""If this is some kind of practical joke, it's not funny, and I know funny. I'm a clownfish."" Happy #AprilFools Day! http://t.co/GKOSiVAd2h",[]
642012267282698240,1441902627,[],rt:641370445766389760,0,127,"RT @DisneyAnywhere: Get Monsters, Inc. for free! Connect your accounts and get started: http://t.co/YBjdeYewkL http://t.co/Vq1HiZGmc3",[2755476668]
234771470008590336,1344808854,"[""findingnemo3d""]",,63,174,"“It has been three weeks since my last fish, on my honor!” #FindingNemo3D http://t.co/kqM9WPrh",[]
93077594727137280,1311026402,[],,26,40,Developing a diabolical genius. http://di.sn/B0,[]
57201230216302592,1302472810,"[""toystory""]",,65,245,"""¡Buzz Lightyear al rescate!"" #ToyStory http://yfrog.com/h4md17j",[]
511990415919423488,1410903002,[],,1256,852,It's the little things. http://t.co/JexEuIXdVx,[]
242020605656956928,1346537183,"[""monstersinc""]",,76,240,"“Hey, did you lose weight, or a limb?” - Sulley, #MonstersInc",[]
666696810568794112,1447787880,"[""dinoweek""]",,580,149,Make your own terrarium inspired by @TheGoodDinosaur #DinoWeek: https://t.co/t56WSzgFNr https://t.co/tnBB1QPPR7,[2842240426]
530498279029895169,1415315620,"[""toystory4""]",,3165,5105,"There's a sequel in our boot: #ToyStory4, directed by John Lasseter, in theatres 6/16/2017! http://t.co/GGroIdQRkg http://t.co/AF0nLQN7IU",[]
586570592540844032,1428684301,"[""nationalsiblingsday""]",,809,535,"Siblings are there for the good, the bad, and the weird. #NationalSiblingsDay http://t.co/6c34qj5FNL",[]
493923868932063235,1406595601,[],,551,318,Believe in yourself. http://t.co/w55Vb0bjbO,[]
620419886788034560,1436754602,[],,1474,1134,But the weekend can't be over yet. http://t.co/I7N2DmxVMe,[]
366006316092755968,1376097680,"[""d23expo""]",,62,36,"""That was a near-drowning experience."" -@andrewstanton on scuba diving research for Finding Nemo back in 1999. #D23Expo",[34678147]
327465821100199937,1366908910,"[""monstersu""]",,65,131,Throwback Thursday: Head back to school with Mike &amp; Sulley in the new #MonstersU Trailer on @YahooMovies: http://t.co/cHoUTlYtC3,[17852343]
586257287871868932,1428609604,[],,374,130,Can you guess the Pixar movie from the last line of dialogue? Take the quiz: http://t.co/iUP2cUFtG4 http://t.co/dEHdaB4Iu9,[]
334021731234766848,1368471961,[],,43,45,"“It’s kind of the quiet, reserved judgement that really sends the chills up your spine.” - Kesley Mann http://t.co/maYflts12B",[]
608680062867615744,1433955610,[],,1149,388,"""A gem of a short film has a sense of pure joy in animation."" —John Lasseter http://t.co/0kYO5qMuNR",[]
281095258316632064,1355853306,"[""monstersinc3d""]",,96,328,Just one day left until #MonstersInc3D!,[]
589465921103736833,1429374601,[],,605,163,Amateur hour. http://t.co/EfQSVkOdkG,[]
611986856192966660,1434744011,"[""insideout""]",,707,288,Experience a world of emotions with these international #InsideOut posters: http://t.co/rS3ILoZgVl http://t.co/Qmkhq7MeuU,[]
116270585901879296,1316556042,[],,38,138,"""Oh, wow.""",[]
246660540011778048,1347643430,"[""findingnemo3d""]",,41,167,"Fish, friends, and most of all, family. Take yours to see #FindingNemo3D, in theaters today! http://t.co/fvkHEO6A",[]
44812293384577024,1299519057,[],,19,117,RT @GMA Recreating a Scene From @DisneyPixar's 'Up' http://abcn.ws/ffZ7M6,"[22650211, 43192807]"
504070737670733824,1409014803,[],,512,198,Here's to one great pit crew. http://t.co/uWMmMp9U8X,[]
154698868330741762,1325718059,[],,170,557,Make that blank page less intimidating--put something on it!,[]
431550514321293312,1391724635,"[""up""]",,860,613,Age ain't nothing but a number. #Up http://t.co/nzrpm9zSnj,[]
471689255388192768,1401294456,[],,310,131,.@DisneyInfinity is about to change your fate... http://t.co/vdSnpwkoNy,[807289412]
366007260981370880,1376097905,[],,116,160,"""On the Internet you're looking at someone else's interpretation of reality. The audience wants YOUR interpretation of reality."" Pete Docter",[]
644300738823356416,1442448241,[],,1004,427,Adventure happens on the unpaved road. http://t.co/DXlTE5HOo2,[]
479836047149645825,1403236803,[],,1075,708,"Lava, a musical love story that takes place over millions of years, will be the short in front of Inside Out. http://t.co/2x6wPEQvqq",[]
664652703860023297,1447300527,"[""gooddino""]",rt:664613773500481537,0,458,"RT @TheGoodDinosaur: Just trying to make it extra clear, @TheGoodDinosaur​ hits theatres in 3D in two weeks! #GoodDino
https://t.co/UXfo7Ez…","[2842240426, 2842240426]"
577846870627733504,1426604404,[],,535,174,Bring in the new day with open arms (and a dapper ascot). http://t.co/dMdPqpXe4H,[]
228550997755191296,1343325778,"[""brave""]",,50,76,“The development process and the creative process is ever-changing.” #Brave producer Katherine Sarafian http://t.co/huQcWsyP,[]
387671970642288640,1381263175,"[""monstersu""]",,83,82,Today is the day! #MonstersU is now available to own in eye-popping Digital HD! http://t.co/pAHqhc3vFs,[]
169556798729228289,1329260465,[],,141,393,Carl and Ellie made it to Paradise Falls after all. http://t.co/2Mic84jm,[]
176080216513454080,1330815769,"[""cars""]",,38,85,"“I have followed racing my entire life, my whole life!” #Cars http://t.co/9RKplgh6",[]
89091327509274625,1310076002,"[""eastereggs""]",,123,151,Everything you think you thought you saw when you saw Cars 2: http://di.sn/9v #eastereggs,[]
451796237113913344,1396551591,[],,636,368,The best plans can be both simple and insane. http://t.co/Y5NBpEnAai,[]
390635657489432576,1381969773,[],,112,102,"Get an inside look at the making of our TV special, Toy Story OF TERROR! http://t.co/XBSNiqrXns",[]
664963214380154881,1447374559,"[""thegooddinosaur""]",rt:664861021375451136,0,152,RT @HuffPostEnt: It's jurassic story time in this exclusive clip from Pixar's #TheGoodDinosaur https://t.co/JWHnApBtpn https://t.co/4voJzKh…,[22208192]
623900361405923328,1437584412,"[""d23expo""]",,432,114,Take your fandom to infinity and beyond at our panels in this year's @DisneyD23 #D23EXPO: http://t.co/BEFbMgQJ4l http://t.co/A22JWabkEJ,[29236490]
666391237281222656,1447715026,[],,1169,527,"The ocean is in motion in this new @FindingDory poster:
https://t.co/7lLDnOqMtJ",[3352522786]
309013096008122368,1362509437,[],,124,176,Exit buddies: don’t cruise the EAC without one. http://t.co/W0Hws5IDFL,[]
65108919814598656,1304358150,"[""monstersinc""]",,73,155,MOVIEBARCODE crunched every frame of #MonstersInc into a single image. http://di.sn/1V,[]
209405011795509248,1338761020,"[""walle""]",,175,490,“Eee-vah!” #WALLE http://t.co/QKddLbEo,[]
103513638228336640,1313514549,[],,42,153,Sometimes you have to dress to impress. Ken goes through 21 different outfits in his quest to woo Barbie. http://di.sn/Dn,[]
555575107884965889,1421294402,[],,692,317,"What it's like to wait for the next Pixar movie, as told by Pixar characters: http://t.co/zFUJGQHt4M http://t.co/6mqbpV1CIl",[]
172606729815719937,1329987625,"[""brave""]",,228,976,Watch a full scene from #Brave in the brand new trailer http://t.co/WYIkt3ap,[]
615203023523086336,1435510805,"[""insideout""]",,1419,382,"""Signal the husband."" #InsideOut http://t.co/YY5JmxKT2W",[]
632994787726000128,1439752692,"[""d23expo""]",,917,230,Prehistory is in the making at #D23EXPO. @TheGoodDinosaur is making the trek to @DisneyInfinity 3.0 this November! http://t.co/ipHCWRtZBu,"[2842240426, 807289412]"
434383039003910144,1392399961,[],,1471,1227,"These two always make our hearts happy. Have a great Valentine's Day, everyone! http://t.co/4uoejp1kT7",[]
41996141608435712,1298847635,"[""up""]",,60,231,"""We're on our way, Ellie."" #Up http://yfrog.com/gyzd2p",[]
598525620910456832,1431534602,[],,722,269,Everything's just dine and dandy. http://t.co/rl7YOXFf5r,[]
86481410881359872,1309453749,[],,477,1272,The future isn't about doing just one thing and doing it well. It's about the challenge of doing/knowing many things and constantly growing.,[]
181500582299836416,1332108085,"[""findingnemo""]",,226,778,“I look at you and... I’m home.” #FindingNemo http://t.co/lmFb48Ak,[]
632001201366790144,1439515803,[],,689,187,Rex’s Arms are His Only Shortcoming: http://t.co/UD0EIpVoWF http://t.co/fWP1ZlHG3L,[]
632971843788386304,1439747222,"[""d23expo""]",,1149,383,Feeling all the feels on the last day of #D23EXPO. http://t.co/z2p6bdyo3V,[]
674029881848668160,1449536221,"[""disneygift""]",,1130,330,It’s the most wonderful playtime of the year. #DisneyGift https://t.co/BJ4ITxVW3e,[]
227906078074085377,1343172020,[],,231,335,"“I always like mundane things with very fantastical things.” - La Luna director Enrico Casarosa, @sketchcrawl http://t.co/h79N6zHi",[62871332]
657346954796625920,1445558701,[],,1484,770,"""I think you've had enough tea for today."" https://t.co/fh2JV8ABMO",[]
89018961869545472,1310058749,[],,72,137,"""One of the great assets we have is a whole group of people who are always consciously trying to improve on what we're doing."" - Ed Catmull",[]
579809790626533376,1427072401,[],,1599,1066,Explore more. http://t.co/bItXmjyYuQ,[]
181138354358861826,1332021723,"[""theincredibles""]",,85,240,“Luck favors the prepared.” #TheIncredibles http://t.co/hqZ07IIf,[]
96701467133620224,1311890401,[],,167,585,Being an island doesn't always work. Find a person who you really trust and bounce your ideas off them.,[]
664261297597378560,1447207209,[],,2514,1959,"Take a swim down short-term memory lane. Finding Dory splashes into theatres June 2016!
https://t.co/JsasZ4lJrg",[]
273957194511298560,1354151459,[],,272,658,That moment when you get stuck wearing the cone of shame.,[]
498929351778660354,1407789001,[],,1047,576,"""Welcome to the Himalayas!"" http://t.co/1iXfT6Qq5F",[]
656152081963814912,1445273821,[],,150,41,"The sky's the limit. Explore @noahklocek's Cloud Country, a @DisneyHyperion book available November 3: http://t.co/HUnuglL7TR","[1195976484, 36370102]"
389493443480666112,1381697448,"[""sulleybiggreen""]",,149,83,#SulleyBigGreen http://t.co/VDsq04Lo5o,[]
295667811785797633,1359327674,"[""findingnemo""]",,180,280,“Now go have an adventure!” #FindingNemo http://t.co/HNcdTxMA,[]
565570990454091777,1423677606,[],,564,246,Workout goals. http://t.co/0g9Fk3rXT0,[]
589163931144445952,1429302601,[],,512,181,"How to Find Nemo, A Step-by-Step Guide: http://t.co/XTJyVuPfjV http://t.co/VAFL84rY3A",[]
224987849643139072,1342476258,"[""up""]",,145,295,Adventure is out there! #Up http://t.co/0dBLIoFj,[]
320232631348387840,1365184383,"[""pixarperspective""]",,219,514,#PixarPerspective: you can’t run away from who you are.,[]
186137127547973634,1333213524,"[""brave""]",,38,78,Soon you’ll be able to meet the very #Brave Merida IRL: http://t.co/7Fo2ZgVf,[]
605781017463382016,1433264424,"[""gooddino""]",,6451,4101,"But what if...#GoodDino
https://t.co/T7dgjWK2x4",[]
660138603637547008,1446224282,[],,851,404,Squawk goals. https://t.co/BkdSqhEToL,[]
306834839573786624,1361990101,"[""brave""]",,230,279,Celebrating Oscar's homecoming at Pixar: http://t.co/G4MM89rH2I #Brave,[]
554034965181386752,1420927203,"[""funday"", ""monstersinc"", ""findingnemo""]",,466,144,Ready for @ABCFamily's #FUNDAY? #MonstersInc &amp; #FindingNemo air tonight at 7:30|6:30c &amp; tomorrow night at 6:30|5:30c. http://t.co/9lQ2v80wDI,[40105401]
173543266451591168,1330210913,"[""findingnemo""]",,90,470,"“I am a nice shark, not a mindless eating machine.” #FindingNemo http://t.co/eQ8JW2JD",[]
600118615308894208,1431914402,[],,768,286,"""I knew there was something I didn't like about that chicken."" http://t.co/rjWM0qoi5B",[]
383727817990500352,1380322815,[],,303,297,Weekend ahoy! http://t.co/1c3uRWuida,[]
346296896425455617,1371398588,"[""monstersu""]",,93,176,Happy Father’s Day! #MonstersU,[]
579100119812964352,1426903202,[],,397,148,9 signs you're the Heimlich of your friend group: http://t.co/VtLZkUo7DM http://t.co/8PmSKPtDm4,[]
609155661784567808,1434069001,[],,558,245,Big change can happen in small doses. http://t.co/E22gRi2rpV,[]
567088466862039041,1424039401,[],,663,179,It's a trap! http://t.co/Gq62Zg8S7Q,[]
420977746227892225,1389203890,"[""monstersu""]",,323,156,Congratulations to the whole team: #MonstersU received a @BAFTA nomination for Best Animated Film!,[17229809]
664990676048674820,1447381106,"[""gooddino""]",rt:664970907241181184,0,320,"RT @TheGoodDinosaur: Dang!  Hear the tale straight from Butch himself.  Check out this new clip from @TheGoodDinosaur! #GoodDino
https://t.…","[2842240426, 2842240426]"
608068044737249281,1433809693,"[""insideout""]",,298,46,"Goodbye, Sadness. Hello, Sassiness! Phyllis Smith works it on the #InsideOut purple carpet. http://t.co/W00wBiQVFb",[]
469199844616450048,1400700934,[],,1289,1294,"If it doesn’t exist, invent it.",[]
305089914377207808,1361574078,"[""brave""]",,42,36,Hear #Brave director Mark Andrews’ advice for young filmmakers on the official Oscars App: http://t.co/ykS69pV7c9,[]
611564066163789824,1434643210,"[""toystory3""]",,1434,660,You've had a friend in #ToyStory3 since this day in 2010 http://t.co/5CEMaVJ3jC,[]
415630500087095296,1387929008,[],,957,895,Sulley is certainly in the holiday spirit. He even decorated his best friend! http://t.co/YZ9pfDlKo4,[]
542756756385177600,1418238269,"[""askinsideout""]",rt:542756699824594945,0,22,RT @PixarInsideOut: Out of time -- thanks everybody for checking out the trailer!  Special thanks to @iTunesTrailers and the questions! #As…,"[2774426570, 24019308]"
292355832983719936,1358538036,[],,266,544,Pro Tip: don’t be afraid to ask questions.,[]
552306062100291584,1420515001,[],,1355,575,Follow your gut. http://t.co/NywUaVFjQI,[]
216332520860561408,1340412666,[],,44,88,We’re into the phrase “mad archery skills.” Read about our strong female characters at @USATODAYlife: http://t.co/Y8r0DLDr,[15764283]
339452349464584192,1369766721,[],,121,181,"Whether you’re a monster or a human, there’s nothing like opening an acceptance letter from your favorite university http://t.co/wolHM5NPA2",[]
510555963372609538,1410561002,[],,411,166,Tough crowd. http://t.co/JpYbjl3XuO,[]
530902533288759298,1415412002,[],,619,315,Go exploring. You never know what you might find. http://t.co/dTzacgtSZk,[]
454317750941282304,1397152767,[],,145,77,"If you could be any Toy Story character, who would it be? Find out with this quiz: http://t.co/yExO3fD6xB",[]
100325633128804353,1312754469,"[""findingnemo""]",,70,213,"""Remember: rip it, roll it, and punch it!"" #FindingNemo http://di.sn/Cd",[]
638873223732572160,1441154220,[],,1128,369,There's nothing more satisfying than the perfect pairing. http://t.co/7kadEruXPf,[]
516709012507983874,1412028003,[],,394,163,Nothing to see here. http://t.co/T3NmgrVEzP,[]
632705444377575425,1439683707,"[""toystory20th"", ""d23expo""]",,307,85,"""We wanted to make it very believable."" -Bob Pauley, production designer, on the importance of toy research #ToyStory20th #D23EXPO",[]
638176891225153536,1440988202,[],,1688,1495,Monday is upon us. http://t.co/uCPA2VGKdi,[]
529687026778787840,1415122202,[],,450,169,Kids these days. http://t.co/XjQ5T5E7aq,[]
570644428261593088,1424887208,[],,1052,627,"""Shark Bait! Ooh-ha-ha!"" http://t.co/5BJBG4DWha",[]
533008911109218306,1415914201,"[""thatawkwardmoment""]",,833,441,#ThatAwkwardMoment when you catch a rat making soup. http://t.co/GAEGTVVHXT,[]
448590904363081728,1395787380,[],,195,108,Be bold. Support your team. Pixar characters really know how to be effective leaders: http://t.co/m1YIuiDT0L,[]
153385416756690944,1325404907,[],,57,288,Happy New Year!,[]
580500593116110850,1427237101,"[""toystory""]",,303,135,You’ve got a friend in @tomhanks reenacting #ToyStory: http://t.co/5o0KdpV46B,[50374439]
628248998541979648,1438621208,[],,446,168,Dory’s Guide to Making New Friends: http://t.co/Q4Sw7d2yU6 http://t.co/9VJ18fjlF9,[]
671434092748136450,1448917337,[],,4541,2897,Make the best of a bat situation.  https://t.co/mhEM1YEN4L,[]
230344942956978176,1343753488,[],,55,77,The @HollywoodBowl Orchestra will be performing music from our films at “Pixar in Concert.” Find tickets: http://t.co/4sGhfkbM,[38530157]
636697412665344000,1440635467,"[""nationaldogday""]",,2760,1887,"""Hi there."" #NationalDogDay
https://t.co/o3oLrg6Kay",[]
626874931402403840,1438293605,[],,669,300,7 LAVA GIFs to Soothe Your Soul: http://t.co/dMtFILUbF7 http://t.co/xdxOFCPUVc,[]
365907859466231808,1376074206,"[""d23expo""]",,65,90,"Now onto Toy Story of TERROR! The #D23Expo got a sneak peek, but the full TV special will air October 16.",[]
669996873327902720,1448574677,[],,509,194,"A cornucopia of adventure awaits. Happy Thanksgiving from @thegooddinosaur!
https://t.co/S6dBlyZjx2",[2842240426]
668250296305479680,1448158260,"[""dinoweek""]",,457,103,'Quiz: Which Character from @thegooddinosaur Are You Most Like?' #DinoWeek: https://t.co/f2mL5p9HnK https://t.co/C6GxLuWCG7,[2842240426]
104683356838563840,1313793431,"[""d23expo""]",,39,378,"Extra! Extra! The next Toy Story Toon, ""Small Fry,"" will premiere before The Muppets on November 23 #D23Expo",[]
642022982848790528,1441905181,[],,620,190,"""The Axiom: putting the 'star' in executive Starliner!"" http://t.co/gOGWReWz4W",[]
633042277732978688,1439764015,"[""d23expo""]",,363,87,"""Little by little, the character starts to form."" -Sculptor Greg Dykstra #D23EXPO http://t.co/KZqQ3IoYmK",[]
590303949707706368,1429574403,[],,245,66,Poll: Disney•Pixar Face-Off. Cast your vote: http://t.co/HBEHZOBLbE http://t.co/qv40J8qLxi,[]
373882948870619136,1377975616,"[""monstersu""]",,260,211,They’re back! #MonstersU http://t.co/9YjzGZI98g,[]
621831686217728000,1437091201,"[""tbt""]",,872,289,"♫ He's the rootinest, tootinest, shootinest, hootinest cowboy around — Woody's Roundup. ♫ #TBT http://t.co/bl7adDsdT9",[]
597076073436819457,1431189003,[],,1004,424,"""No."" http://t.co/XmRzNfSlKV",[]
260426180145074176,1350925414,"[""pixarperspective""]",,348,1013,#PixarPerspective: If you focus on what you’ve left behind you will never be able to see what lies ahead.,[]
53864368236007424,1301677240,[],,84,219,We quit. http://youtu.be/YnbHJDBT-pY,[]
